talk_id,title,favored_option,option_opinion,opinion_strength
1162,"We need a ""moral operating system""",C,For,Very strong
1163,Building a dinosaur from a chicken,C,For,Extremely strong
1164,Taking imagination seriously,C,For,Extremely strong
1165,The world's first charter city?,E,For,Very strong
1166,Is anatomy destiny?,C,For,Extremely strong
1167,Break the silence for suicide attempt survivors,C,For,Extremely strong
1168,Medicine's future? There's an app for that,B,For,Very strong
1169,How I became 100 artists,C,For,Extremely strong
1170,"A manifesto for play, for Bulgaria and beyond",C,For,Extremely strong
1171,Haunting photos of polar ice,A,For,Extremely strong
1172,This is beatjazz,B,For,Extremely strong
1173,A cello with many voices,C,For,Very strong
1174,A future beyond traffic gridlock,A,For,Very strong
1175,Different ways of knowing,C,For,Very strong
1176,A circle of caring,C,For,Extremely strong
1177,A history of the universe in sound,B,For,Extremely strong
1178,On being just crazy enough,C,For,Very strong
1180,A Rosetta Stone for a lost language,C,For,Very strong
1181,Meet e-Patient Dave,C,For,Extremely strong
1182,Building a park in the sky,A,For,Extremely strong
1183,Try something new for 30 days,C,For,Very strong
1184,Cooking as never seen before,B,For,Extremely strong
1185,The beautiful tricks of flowers,A,For,Extremely strong
1186,Don't take consciousness for granted,B,For,Very strong
1187,Caring for engineered tissue,B,For,Extremely strong
1188,Let's take back the Internet!,D,Against,Very strong
1189,A global culture to fight extremism,G,For,Extremely strong
1190,"Trial, error and the God complex",C,For,Extremely strong
1191,See Yemen through my eyes,C,For,Extremely strong
1192,"Fighting viruses, defending the net",B,For,Extremely strong
1193,"Embracing otherness, embracing myself",C,For,Extremely strong
1194,How algorithms shape our world,B,Against,Very strong
1195,A robot that flies like a bird,B,For,Extremely strong
1196,Time to end the war in Afghanistan,C,For,Very strong
1197,The surprising math of cities and corporations,B,For,Extremely strong
1198,The origins of pleasure,C,For,Extremely strong
1199,Ending hunger now,E,For,Extremely strong
1200,5 ways to listen better,C,For,Extremely strong
1201,After your final status update,D,For,Very strong
1202,Wireless data from every light bulb,B,For,Extremely strong
1203,How language transformed humanity,E,Against,Extremely strong
1204,Are we filtering the wrong microbes?,A,For,Very strong
1205,"Suddenly, my body",C,For,Extremely strong
1206,The demise of guys?,C,Against,Very strong
1207,The shareable future of cities,A,For,Extremely strong
1208,The great penguin rescue,A,For,Extremely strong
1209,One day of peace,A,For,Extremely strong
1210,Finding planets around other stars,B,For,Very strong
1211,The magic of truth and lies (and iPods),B,For,Extremely strong
1212,Beware conflicts of interest,C,Against,Very strong
1213,DNA clues to our inner neanderthal,B,For,Very strong
1214,Pay attention to nonviolence,C,For,Very strong
1215,Can we make things that make themselves?,B,For,Extremely strong
1216,Compassion and the true meaning of empathy,C,For,Extremely strong
1217,Unintended consequences,C,For,Extremely strong
1120,My father the forger,C,For,Extremely strong
1218,Making matter come alive,B,For,Extremely strong
1219,Shake up your story,C,For,Extremely strong
1220,Does democracy stifle economic growth?,C,For,Very strong
1221,Hire the hackers!,B,For,Very strong
1222,The art of wearable communication,C,For,Very strong
1223,Welcome to the genomic revolution,C,For,Extremely strong
1224,The conscience of television,C,For,Extremely strong
1226,The 6 killer apps of prosperity,B,For,Extremely strong
1227,What we learned from 5 million books,C,For,Very strong
1228,Selling condoms in the Congo,C,For,Very strong
1229,Fighting a contagious cancer,B,For,Extremely strong
1230,"Doodlers, unite!",C,For,Very strong
1231,A doctor's touch,C,For,Extremely strong
1232,A short intro to the Studio School,C,For,Very strong
1233,Filming democracy in Ghana,A,For,Very strong
1234,Battling bad science,C,For,Extremely strong
1235,A flirtatious aria,F,For,Extremely strong
1236,The generation that's remaking China,C,For,Strong
1237,Finding life we can't imagine,B,For,Extremely strong
1238,"Less stuff, more happiness",C,For,Very strong
1239,We can recycle plastic,B,For,Very strong
1240,Trusting the ensemble,C,For,Extremely strong
1241,What do babies think?,C,For,Very strong
1243,How beauty feels,C,For,Very strong
1244,The day I turned down Tim Berners-Lee,B,For,Very strong
1246,How to spot a liar,C,For,Very strong
1247,My mushroom burial suit,A,For,Extremely strong
1248,Learning from a barefoot movement,C,For,Extremely strong
1249,Freeing energy from the grid,B,For,Extremely strong
1250,How cyberattacks threaten real-world peace,B,Against,Extremely strong
1251,"A prosthetic arm that ""feels""",B,For,Very strong
1252,Art made of storms,B,For,Extremely strong
1253,How economic inequality harms societies,C,For,Very strong
1255,The strange tale of the Norden bombsight,B,Against,Extremely strong
1256,Open-source cancer research,B,For,Extremely strong
1257,Stories cut from paper,A,For,Extremely strong
1258,"FBI, here I am!",D,For,Extremely strong
1259,"Trust, morality -- and oxytocin?",C,For,Very strong
1260,A plane you can drive,F,For,Strong
1261,The real reason for brains,B,For,Extremely strong
1262,"Augmented reality, techno-magic",B,For,Strong
1242,How mobile phones helped solve two murders,D,For,Very strong
1263,The right to understand,C,For,Extremely strong
1264,The line between life and not-life,B,For,Very strong
1265,High-tech art (with a sense of humor),C,For,Very strong
1266,Ancient wonders captured in 3D,B,For,Extremely strong
1267,A map of the brain,C,For,Extremely strong
1269,The shared experience of absurdity,NA,NA,NA
1268,6 ways to save the internet,B,For,Very strong
1245,Open science now!,C,For,Very strong
1270,Conception to birth -- visualized,C,For,Extremely strong
1271,Fly with the Jetman,F,For,Strong
1272,A 12-year-old app developer,B,For,Very strong
1274,Experiments that hint of longer lives,C,For,Very strong
1276,Science versus wonder?,B,For,Very strong
1278,How games make kids smarter,C,For,Extremely strong
1279,Being young and making an impact,C,For,Very strong
1280,How to defend Earth from asteroids,B,For,Extremely strong
1281,"Meet Rezero, the dancing ballbot",B,For,Strong
1282,The technology of storytelling,C,For,Strong
1284,A garden in my apartment,C,For,Very strong
1285,Living beyond limits,C,For,Extremely strong
1286,Philosophy in prison,C,For,Very strong
1289,What we learn before we're born,C,For,Extremely strong
1290,"Dance vs. powerpoint, a modest proposal",C,For,Very strong
1291,Building the musical muscle,B,For,Very strong
1287,Don't regret regret,C,For,Very strong
1292,Don't misrepresent Africa,C,Against,Very strong
1293,How many lives can you live?,C,For,Very strong
1294,How to topple a dictator,C,For,Very strong
1295,Massive-scale online collaboration,C,For,Extremely strong
1296,The magnificence of spider silk,B,For,Extremely strong
1297,Ultrasound surgery -- healing without cuts,B,For,Very strong
1298,There are no mistakes on the bandstand,B,For,Very strong
1299,The world's smallest 3D printer,B,For,Very strong
1300,What happens when an NGO admits failure,C,For,Very strong
1301,The hidden light of Afghanistan,F,For,Extremely strong
1302,Color-coded surgery,B,For,Very strong
1303,Put a value on nature!,E,For,Extremely strong
1304,Cooking as alchemy,B,For,Extremely strong
1305,An unexpected place of healing,C,For,Extremely strong
1306,My subversive (garden) plot,C,For,Very strong
1307,Medicine for the 99 percent,C,For,Extremely strong
1308,The quest to understand consciousness,C,For,Extremely strong
1309,A prosthetic eye to treat blindness,B,For,Very strong
1310,The battle between your present and future self,C,For,Very strong
1288,How to stop torture,C,For,Very strong
1311,There are no scraps of men,C,For,Extremely strong
1312,How healthy living nearly killed me,C,For,Very strong
1313,Life's third act,C,For,Very strong
1314,The global power shift,B,For,Very strong
1315,"1,000 TED Talks in six words",C,For,Very strong
1317,Can astronomers help doctors?,B,For,Extremely strong
1318,Be suspicious of simple stories,C,Against,Very strong
1320,Award-winning teenage science in action,C,For,Extremely strong
1321,In defense of dialogue,C,For,Extremely strong
1322,Animations of unseeable biology,B,For,Extremely strong
1323,"""Women of Hope""",G,For,Extremely strong
1324,"Thorium, an alternative nuclear fuel",B,For,Very strong
1325,The debut of the British Paraorchestra,G,For,Very strong
1326,Meet the Water Canary,B,For,Extremely strong
1327,Atheism 2.0,C,For,Very strong
1328,Three types of online attack,B,Against,Extremely strong
1329,Why SOPA is a bad idea,D,Against,Extremely strong
1330,How to make choosing easier,C,For,Very strong
1331,The beautiful math behind the world's ugliest music,B,For,Very strong
1332,Plant fuels that could power a jet,A,For,Extremely strong
1334,Is there a real you?,C,For,Very strong
1335,A primer on 3D printing,B,For,Extremely strong
1336,Extreme swimming with the world's most dangerous jellyfish,G,For,Extremely strong
1337,Doctors make mistakes. Can we talk about that?,C,For,Extremely strong
1339,"Women entrepreneurs, example not exception",C,For,Very strong
1341,What happens inside those massive warehouses?,B,For,Very strong
1342,Why I chose a gun,B,For,Extremely strong
1343,Treating cancer with electric fields,B,For,Extremely strong
1344,The happy secret to better work,C,For,Extremely strong
1345,The universal anesthesia machine,B,For,Very strong
1346,Back to the future (of 1994),B,For,Extremely strong
830,Hooked by an octopus,A,For,Very strong
1348,Let's bridge the digital divide!,C,For,Extremely strong
1347,The secret structure of great talks,C,For,Extremely strong
1349,How your brain tells you where you are,C,For,Extremely strong
1350,"Non-lethal weapons, a moral hazard?",B,Against,Very strong
1351,"Globalizing the local, localizing the global",C,For,Very strong
1352,Where are the baby dinosaurs?,C,For,Extremely strong
1353,Impossible photography,C,For,Strong
1355,Everyday leadership,C,For,Extremely strong
1354,Deaf in the military,C,For,Extremely strong
1356,The toxic baby,A,For,Extremely strong
1357,What you don't know about marriage,C,For,Very strong
1359,Crowdsource your health,C,For,Very strong
1360,How do you save a shark you know nothing about?,B,For,Extremely strong
1361,How mobile phones power disaster relief,B,For,Extremely strong
1362,The true cost of oil,A,Against,Extremely strong
1363,Look up for a change,A,For,Very strong
1364,2600 years of history in one object,C,For,Extremely strong
1365,Comedy is translation,C,For,Very strong
1366,Using tech to enable dreaming,B,For,Extremely strong
1367,"Saving for tomorrow, tomorrow",C,For,Extremely strong
1368,My immigration story,C,For,Very strong
1370,All your devices can be hacked,B,For,Extremely strong
1369,The sibling bond,C,For,Extremely strong
1371,Why videos go viral,D,For,Very strong
1373,The ocean's shifting baseline,C,For,Very strong
1372,A census of the ocean,A,For,Extremely strong
1375,Abundance is our future,B,For,Extremely strong
1374,The Earth is full,A,Against,Extremely strong
1376,Robots that fly ... and cooperate,B,For,Extremely strong
1377,The power of introverts,C,For,Very strong
1378,We need to talk about an injustice,C,For,Extremely strong
1379,The clues to a great story,C,For,Extremely strong
1380,Why I must speak out about climate change,A,For,Extremely strong
1381,Coding a better government,B,For,Very strong
1382,A TED speaker's worst nightmare,B,For,Mild
1383,Design to challenge reality,C,For,Very strong
1384,Why you will fail to have a great career,C,Against,Extremely strong
1385,The cockroach beatbox,B,For,Extremely strong
1386,Questions no one knows the answers to,B,For,Very strong
1387,Deep ocean mysteries and wonders,A,For,Extremely strong
1388,How simple ideas lead to scientific discoveries,B,For,Extremely strong
1389,"Religion, evolution, and the ecstasy of self-transcendence",C,For,Very strong
1390,The $8 billion iPod,D,Against,Very strong
1391,Listening to shame,C,For,Extremely strong
1392,Beautiful artificial limbs,B,For,Very strong
1393,Victims of the city,C,For,Very strong
1394,Let's transform energy -- with natural gas,B,For,Extremely strong
1396,The single biggest health threat women face,C,For,Extremely strong
1397,"Yup, I built a nuclear fusion reactor",B,For,Extremely strong
1398,"Everyday moments, caught in time",C,For,Very strong
1400,Make data more human,C,For,Very strong
1399,Let's talk about dying,C,For,Extremely strong
1401,The missing link to renewable energy,B,For,Extremely strong
1402,From mach-20 glider to hummingbird drone,B,For,Extremely strong
1403,"Unlock the intelligence, passion, greatness of girls",C,For,Extremely strong
1404,"Building blocks that blink, beep and teach",B,For,Extremely strong
1405,A magical tale (with augmented reality),C,For,Very strong
1406,Inventing is the easy part. Marketing takes work,C,For,Very strong
1407,I am a pirate,C,For,Extremely strong
1408,The secret life of plankton,A,For,Extremely strong
1409,"Connected, but alone?",C,For,Very strong
1410,"Designing books is no laughing matter. OK, it is.",C,For,Very strong
1411,On the virtual dissection table,B,For,Extremely strong
1413,How can technology transform the human body?,B,For,Extremely strong
1415,"""Put the financial aid in the bag""",E,Against,Extremely strong
1412,The other inconvenient truth,A,For,Extremely strong
1416,Half a million secrets,C,For,Very strong
1417,Moral behavior in animals,C,For,Extremely strong
1418,Let's put birth control back on the agenda,C,For,Very strong
1419,How I repaired my own heart,C,For,Very strong
1420,Building US-China relations ... by banjo,F,For,Extremely strong
1421,How do we heal medicine?,C,For,Very strong
1422,How I beat a patent troll,E,Against,Extremely strong
1423,The stories behind the bloodlines,C,For,Very strong
1424,Older people are happier,C,For,Very strong
1425,Tracking ancient diseases using ... plaque,B,For,Very strong
1426,Is our universe the only universe?,B,For,Very strong
1427,How to buy happiness,E,Against,Very strong
1428,Just how small is an atom?,B,For,Extremely strong
1429,The 4 commandments of cities,C,For,Very strong
1430,Texting that saves lives,C,For,Extremely strong
1431,How to use a paper towel,A,For,Extremely strong
1432,Gaming for understanding,C,For,Extremely strong
1433,A new museum wing ... in a giant bubble,C,For,Extremely strong
1434,A 40-year plan for energy,B,For,Extremely strong
1435,Sculpting waves in wood and time,C,For,Strong
1436,Tracking our online trackers,D,Against,Extremely strong
1437,Perspective is everything,C,For,Very strong
1438,A teen just trying to figure it out,C,For,Extremely strong
1439,From stigma to supermodel,C,For,Extremely strong
1440,Music and emotion through time,C,For,Extremely strong
1441,Information is food,C,For,Very strong
1442,"Unseen footage, untamed nature",A,For,Extremely strong
1443,Feats of memory anyone can do,C,For,Extremely strong
1444,"404, the story of a page not found",D,For,Very strong
1446,Beethoven the businessman,C,For,Extremely strong
1445,3 new ways to kill mosquitoes,A,For,Extremely strong
1447,The optimism bias,C,For,Very strong
1448,The mathematics of history,C,For,Very strong
1449,How to build your creative confidence,C,For,Extremely strong
1450,How to look inside the brain,B,For,Very strong
1451,One year of turning the world inside out,C,For,Extremely strong
1452,"Cheap, effective shelter for disaster relief",A,For,Extremely strong
1453,The sea we've hardly seen,C,For,Extremely strong
1454,What's left to explore?,C,For,Very strong
1455,Religions and babies,C,For,Very strong
1456,The journey across the high wire,G,For,Extremely strong
1457,HIV -- how to fight an epidemic of bad laws,A,For,Very strong
1458,Beats that defy boxes,B,For,Extremely strong
1460,A reality check on renewables,B,For,Very strong
1459,4 lessons from robots about being human,B,For,Extremely strong
1461,Revealing the lost codex of Archimedes,C,For,Extremely strong
1462,The attitudes that sparked Arab Spring,C,For,Very strong
1463,What your designs say about you,C,For,Very strong
1464,Dancing with light,A,For,Extremely strong
1465,ET is (probably) out there -- get ready,B,For,Very strong
1466,A new way to stop identity theft,B,For,Extremely strong
1467,Will our kids be a different species?,B,For,Extremely strong
1468,What we didn't know about penis anatomy,B,For,Very strong
1469,Why is 'x' the unknown?,C,For,Extremely strong
1470,Mining minerals from seawater,B,For,Very strong
1471,"Design, explained.",G,For,Extremely strong
1472,A new way to diagnose autism,C,For,Extremely strong
1474,We are all designers,C,For,Extremely strong
1475,What if our health care system kept us healthy?,A,For,Extremely strong
1476,The shared wonder of film,C,For,Extremely strong
1477,Archaeology from space,B,For,Very strong
1478,The myth of the gay agenda,C,For,Extremely strong
1479,Pop an ollie and innovate!,G,For,Extremely strong
1473,Women should represent women in media,C,For,Very strong
1480,Lessons from death row inmates,A,For,Extremely strong
1481,Are we over-medicalized?,C,Against,Very strong
1482,The electric rise and fall of Nikola Tesla,B,For,Extremely strong
1487,"The 100,000-student classroom",C,For,Extremely strong
1483,How to air-condition outdoor spaces,A,For,Very strong
1488,Tour the solar system from home,B,For,Extremely strong
1489,India's invisible innovation,B,For,Very strong
1485,Advice to a young scientist,C,For,Extremely strong
1490,Reinventing the encyclopedia game,C,For,Extremely strong
1491,How Arduino is open-sourcing imagination,B,For,Extremely strong
1492,Four principles for the open world,C,For,Extremely strong
1494,A tale of mental illness -- from the inside,C,For,Extremely strong
1495,The levitating superconductor,B,For,Extremely strong
1498,How I'm preparing to get Alzheimer's,C,For,Extremely strong
1484,What's your 200-year plan?,C,For,Very strong
1499,A novel idea for cleaning up oil spills,B,For,Extremely strong
1500,A young guitarist meets his hero,B,For,Very strong
1501,The game that can give you 10 extra years of life,C,For,Extremely strong
1503,Meet your microbes,C,For,Very strong
1506,"The future race car -- 150mph, and no driver",B,For,Very strong
1496,A vision of crimes in the future,B,Against,Extremely strong
1505,New ways to see music (with color! and fire!),B,For,Extremely strong
1507,How to fool a GPS,B,Against,Very strong
1508,Capturing memories in video art,C,For,Very strong
1509,Experiments that point to a new understanding of cancer,B,For,Very strong
1510,Let's crowdsource the world's goals,C,For,Extremely strong
1514,Sometimes it's good to give up the driver's seat,C,For,Very strong
1515,Image recognition that triggers augmented reality,B,For,Very strong
1512,I listen to color,B,For,Extremely strong
1517,The greatest machine that never was,B,For,Extremely strong
1516,Technology crafts for the digitally underserved,B,For,Very strong
1513,A Navy Admiral's thoughts on global security,B,For,Extremely strong
1518,Your phone company is watching,D,Against,Very strong
1521,Finding the story inside the painting,C,For,Very strong
1520,Imaging at a trillion frames per second,B,For,Extremely strong
1519,Building unimaginable shapes,B,For,Extremely strong
1522,Every city needs healthy honey bees,C,For,Very strong
1528,When a reporter becomes the story,C,For,Very strong
1523,Behind the Great Firewall of China,D,For,Very strong
1530,A teacher growing green in the South Bronx,C,For,Extremely strong
1531,What we're learning from online education,C,For,Extremely strong
1532,(Re)touching lives through photos,C,For,Very strong
1526,The mad scientist of music,C,For,Very strong
1543,Is life really that complex?,C,For,Very strong
1542,Fighting with nonviolence,C,For,Extremely strong
1533,Dare to disagree,C,For,Extremely strong
1534,A test for Parkinson's with a phone call,C,For,Very strong
1538,How we can eat our landscapes,A,For,Extremely strong
1535,Embrace the remix,B,Against,Very strong
1541,Photos that bear witness to modern slavery,A,For,Extremely strong
1548,What's a snollygoster? A short lesson in political speak,C,For,Very strong
1547,Can democracy exist without trust?,C,Against,Very strong
1545,How to step up in the face of disaster,C,For,Extremely strong
1544,Strange answers to the psychopath test,C,For,Very strong
1549,"Design for people, not awards",C,For,Very strong
1524,The art of creating awe,B,For,Very strong
1555,The power of the informal economy,C,For,Very strong
1556,The rise of human-computer cooperation,C,For,Extremely strong
1551,"Sculpted space, within and without",C,For,Extremely strong
1561,Energy from floating algae pods,A,For,Very strong
1559,Brilliant designs to fit more people in every city,B,For,Very strong
1560,Why eyewitnesses get it wrong,C,For,Very strong
1557,Mental health for all by involving all,C,For,Very strong
1554,The voices of China's workers,C,For,Very strong
1562,The promise of research with stem cells,B,For,Extremely strong
1527,A choreographer's creative process in real time,C,For,Extremely strong
1558,Demand a more open-source government,C,For,Extremely strong
1565,The global food waste scandal,A,For,Extremely strong
1563,The mysterious workings of the adolescent brain,C,For,Very strong
1564,Why architects need to use their ears,C,For,Very strong
1576,Discover the physical side of the internet,B,For,Very strong
1567,Demand a fair trade cell phone,G,Against,Extremely strong
1566,A story about knots and surgeons,A,For,Extremely strong
1572,The currency of the new economy is trust,B,For,Very strong
1574,Are droids taking our jobs?,B,For,Extremely strong
1573,"What we're learning from 5,000 brains",C,For,Very strong
1546,How the Internet will (one day) transform government,C,For,Extremely strong
1578,An animated tour of the invisible,B,For,Extremely strong
1575,What doctors don't know about the drugs they prescribe,C,Against,Extremely strong
1537,A thousand times no,G,For,Extremely strong
1582,Making sense of maps,B,For,Extremely strong
1583,Let's prepare for our new climate,A,For,Extremely strong
1569,Your body language may shape who you are,C,For,Extremely strong
1577,Between music and medicine,C,For,Extremely strong
1586,Terrorism is a failed brand,G,For,Extremely strong
1570,The self-organizing computer course,C,For,Extremely strong
1579,Weaving narratives in museum galleries,C,For,Very strong
1591,3 ways to (usefully) lose control of your brand,C,For,Very strong
1571,"How art, technology and design inform creative leaders",C,For,Very strong
1584,What's so funny about mental illness?,C,For,Extremely strong
1592,Talk nerdy to me,B,For,Very strong
1588,The secret lives of paintings,B,For,Extremely strong
1580,Smart failure for a fast-changing world,B,For,Extremely strong
1585,Let's pool our medical data,C,For,Extremely strong
1587,"Science is for everyone, kids included",C,For,Extremely strong
1594,My battle to expose government corruption,C,For,Extremely strong
1581,"Online video -- annotated, remixed and popped",B,For,Very strong
1593,"Actually, the world isn't flat",C,For,Very strong
1597,The strange politics of disgust,C,For,Very strong
1596,A child of the state,C,For,Extremely strong
1598,Metal that breathes,A,For,Extremely strong
1602,A cyber-magic card trick like no other,B,For,Extremely strong
1595,Why democracy matters,C,For,Very strong
1599,How open data is changing international aid,C,For,Very strong
1605,The secret of the bat genome,A,For,Extremely strong
1606,"Healthier men, one moustache at a time",C,For,Strong
1600,What I've learned from my autistic brothers,C,For,Extremely strong
1607,Want to be happier? Stay in the moment,C,For,Very strong
1608,A new mission for veterans -- disaster relief,C,For,Very strong
1604,The beautiful nano details of our world,B,For,Extremely strong
1601,The tragedy of orphanages,C,For,Extremely strong
1612,The future of lying,C,For,Extremely strong
1613,4 lessons in creativity,C,For,Very strong
1614,How I started a sanitary napkin revolution!,C,For,Extremely strong
1603,Love letters to strangers,D,For,Extremely strong
1609,"How to ""sketch"" with electronics",B,For,Very strong
1552,The arts festival revolution,C,For,Very strong
1618,Your brain on video games,B,For,Very strong
1616,The cheap all-terrain wheelchair,C,For,Extremely strong
1619,Teen wonders play bluegrass,F,For,Extremely strong
1283,Nature. Beauty. Gratitude.,A,For,Extremely strong
1553,Before I die I want to ...,C,For,Very strong
1617,Want to help someone? Shut up and listen!,C,For,Extremely strong
1620,How to solve traffic jams,B,For,Very strong
1621,A broken body isn't a broken person,C,For,Extremely strong
1610,Why I love vultures,A,For,Very strong
1622,"Forget multitasking, try monotasking",C,For,Very strong
1623,Why global jihad is losing,G,Against,Extremely strong
1611,A bath without water,C,For,Extremely strong
1624,Lessons in business ... from prison,C,For,Very strong
1626,Could tissue engineering mean personalized medicine?,B,For,Extremely strong
1625,Please don't take my Air Jordans,C,For,Extremely strong
1627,"Pool medical patents, save lives",C,For,Extremely strong
1630,How to separate fact and fiction online,B,For,Extremely strong
1629,"A Saudi, an Indian and an Iranian walk into a Qatari bar ...",D,For,Strong
1628,The dance of the dung beetle,B,For,Very strong
1631,Why bother leaving the house?,C,For,Very strong
1632,"Excuse me, may I rent your car?",C,For,Very strong
1633,Beware neuro-bunk,B,Against,Very strong
1634,"A father-daughter bond, one photo at a time",F,For,Strong
1638,What we learned from teetering on the fiscal cliff,C,For,Very strong
1636,Israel and Iran: A love story?,C,For,Extremely strong
1637,What fear can teach us,C,For,Very strong
